{
  "apiVersion": "effecta.dev/v1",
  "category": "design",
  "description": "Elite mobile app image-generation skill for creating premium, app-native screen concepts and flows. Designed for iOS, Android, and cross-platform mobile products. Prioritizes clean hierarchy, comfortably readable text, strong multi-screen consistency, controlled color palettes, non-generic creative direction, textured surfaces, image-led composition, tasteful custom iconography, and clean phone mockup framing. By default, screens should be shown inside a subtle premium iPhone or similar phone mockup with a visible frame, while the main focus stays on the app content itself. This skill generates images only. It does not write code.",
  "id": "github:leonxlnx/taste-skill:skills/imagegen-frontend-mobile",
  "kind": "CapabilityPackage",
  "name": "imagegen-frontend-mobile",
  "slug": "imagegen-frontend-mobile--leonxlnx-taste-skill",
  "source": {
    "path": "skills/imagegen-frontend-mobile",
    "repository": "Leonxlnx/taste-skill"
  },
  "type": "skill"
}
