{
  "apiVersion": "effecta.dev/v1",
  "category": "growth",
  "description": "When the user wants to optimize, improve, or increase conversions on any marketing page or form — including homepage, landing pages, pricing pages, feature pages, lead capture forms, or contact forms. Also use when the user says 'CRO,' 'conversion rate optimization,' 'this page isn't converting,' 'improve conversions,' 'why isn't this page working,' 'my landing page sucks,' 'form abandonment,' 'nobody's converting,' 'low conversion rate,' or 'this page needs work.' Use this even if the user just shares a URL and asks for feedback. For signup/registration flows, see signup. For post-signup activation, see onboarding. For popups/modals, see popups.",
  "id": "github:coreyhaines31/marketingskills:skills/cro",
  "kind": "CapabilityPackage",
  "name": "cro",
  "slug": "cro--coreyhaines31-marketingskills",
  "source": {
    "path": "skills/cro",
    "repository": "coreyhaines31/marketingskills"
  },
  "type": "skill"
}
