{
  "apiVersion": "effecta.dev/v1",
  "category": "workflow",
  "description": "Unified media generation via fal.ai MCP — image, video, and audio. Covers text-to-image (Nano Banana), text/image-to-video (Seedance, Kling, Veo 3), text-to-speech (CSM-1B), and video-to-audio (ThinkSound). Use when the user wants to generate images, videos, or audio with AI.",
  "id": "github:affaan-m/ecc:.agents/skills/fal-ai-media",
  "kind": "CapabilityPackage",
  "name": "fal-ai-media",
  "slug": "fal-ai-media--affaan-m-ecc",
  "source": {
    "path": ".agents/skills/fal-ai-media",
    "repository": "affaan-m/ECC"
  },
  "type": "skill"
}
