{
  "apiVersion": "effecta.dev/v1",
  "category": "workflow",
  "description": "Stop hook that blocks Claude from finishing until quality checks pass. Detects rationalization patterns (surface text heuristics), stale learning logs (filesystem mtime), and low disk space. Complements self-audit by mechanically enforcing learning capture habits. Use when Claude should be mechanically blocked from declaring work finished before quality checks and learning capture actually pass.",
  "id": "github:affaan-m/ecc:skills/delivery-gate",
  "kind": "CapabilityPackage",
  "name": "delivery-gate",
  "slug": "delivery-gate--affaan-m-ecc",
  "source": {
    "path": "skills/delivery-gate",
    "repository": "affaan-m/ECC"
  },
  "type": "skill"
}
