{
  "apiVersion": "effecta.dev/v1",
  "category": "workflow",
  "description": "Use up-to-date library and framework docs via Context7 MCP instead of training data. Activates for setup questions, API references, code examples, or when the user names a framework (e.g. React, Next.js, Prisma).",
  "id": "github:affaan-m/ecc:.agents/skills/documentation-lookup",
  "kind": "CapabilityPackage",
  "name": "documentation-lookup",
  "slug": "documentation-lookup--affaan-m-ecc",
  "source": {
    "path": ".agents/skills/documentation-lookup",
    "repository": "affaan-m/ECC"
  },
  "type": "skill"
}
