{
  "apiVersion": "effecta.dev/v1",
  "category": "research",
  "description": "Use when the user is doing AI/ML work in a scientific domain such as biology, chemistry, physics, astronomy, climate, genomics, materials, medicine, ecology, energy, engineering, math, drug discovery, protein design, weather modeling, theorem proving, single-cell, or PDE solving. Hugging Science is a curated catalog of scientific datasets, models, blog posts, and interactive Spaces. This skill helps discover and use resources via `datasets`, `transformers`, the HF Inference API, `gradio_client`, and methodology citations.",
  "id": "github:k-dense-ai/scientific-agent-skills:skills/hugging-science",
  "kind": "CapabilityPackage",
  "name": "hugging-science",
  "slug": "hugging-science--k-dense-ai-scientific-agent-skills",
  "source": {
    "path": "skills/hugging-science",
    "repository": "K-Dense-AI/scientific-agent-skills"
  },
  "type": "skill"
}
